[
  {
    "id": "sundarakanda-start",
    "title": "Начало Сундараканды",
    "description": "Первые стихи пятой книги, описывающие величие Ханумана и его готовность к прыжку через океан.",
    "sections": [
      {
        "label": "Санскрит (IAST)",
        "content": "tato rāvaṇanītāyāḥ sītāyāḥ śatrukarśanaḥ |\niyeṣa padamanveṣṭuṃ cāraṇacariate pathi ||"
      },
      {
        "label": "Подстрочник (М. Леонов)",
        "content": "Тогда истребитель врагов вознамерился искать местопребывание Ситы, похищенной Раваной, на пути, [пройденном] чаранами."
      },
      {
        "label": "Поэтический (В. Потапова)",
        "content": "В полет за Ситой, Раваной похищенной,\nПустился Хануман стезей возвышенной,\nДорогой духов, небо населяющих,\nСреди планет, во тьме ночной сияющих."
      }
    ],
    "commentary": "Этот фрагмент задает тон всей книге. Хануман описывается как 'истребитель врагов' (śatrukarśanaḥ), что подчеркивает его героическую природу."
  },
  {
    "id": "rama-birth",
    "title": "Рождение Рамы",
    "description": "Рождение царевича Рамы в солнечной Айодхье и его божественное происхождение.",
    "sections": [],
    "commentary": ""
  },
  {
    "id": "rama-exile",
    "title": "Изгнание Рамы",
    "description": "Изгнание Рамы, Ситы и Лакшманы в лес на четырнадцать лет и горе царя Дашаратхи.",
    "sections": [],
    "commentary": ""
  },
  {
    "id": "sita-abduction",
    "title": "Похищение Ситы",
    "description": "Коварный Равана похищает Ситу, обернувшись золотым оленем в лесу Панчавати.",
    "sections": [],
    "commentary": ""
  },
  {
    "id": "hanuman-meeting",
    "title": "Встреча с Хануманом",
    "description": "Встреча Рамы и Лакшманы с Хануманом на горе Ришьямука и заключение союза.",
    "sections": [],
    "commentary": ""
  },
  {
    "id": "lanka",
    "title": "Ланка",
    "description": "Хануман находит Ситу в саду Ашока на острове Ланка и передаёт ей весть от Рамы.",
    "sections": [],
    "commentary": ""
  },
  {
    "id": "ravana-battle",
    "title": "Битва с Раваной",
    "description": "Грандиозная битва между войском Рамы и ракшасами Раваны; гибель десятиглавого царя.",
    "sections": [],
    "commentary": ""
  },
  {
    "id": "return-ayodhya",
    "title": "Возвращение в Айодхью",
    "description": "Торжественное возвращение Рамы и Ситы в Айодхью на небесной колеснице и воцарение.",
    "sections": [],
    "commentary": ""
  }
]
